{
  "$schema": "contracts/product-contract.schema.json",
  "contract_version": "mobile-product-contract/v1",
  "product": {
    "name": "AoiTalk",
    "client": "mobile",
    "source_of_truth": "contracts/product-contract.json",
    "version": "p0"
  },
  "navigation": {
    "tabs": [
      "chat",
      "tasks",
      "calendar",
      "filer",
      "docs"
    ],
    "tab_routes": [
      "tabs.chat",
      "tabs.tasks",
      "tabs.calendar",
      "tabs.filer",
      "tabs.docs"
    ],
    "routes": [
      {
        "id": "root",
        "path": "index",
        "kind": "root",
        "auth_required": false,
        "tab": false,
        "entry_points": [
          "bootstrap"
        ]
      },
      {
        "id": "auth.login",
        "path": "(auth)/login",
        "kind": "auth",
        "auth_required": false,
        "tab": false,
        "entry_points": [
          "auth"
        ]
      },
      {
        "id": "tabs.chat",
        "path": "(tabs)/chat/index",
        "kind": "tab",
        "auth_required": true,
        "tab": true,
        "entry_points": [
          "tab.chat"
        ]
      },
      {
        "id": "tabs.chat.detail",
        "path": "(tabs)/chat/[sessionId]",
        "kind": "detail",
        "auth_required": true,
        "tab": false,
        "entry_points": [
          "parent.chat"
        ]
      },
      {
        "id": "tabs.tasks",
        "path": "(tabs)/tasks/index",
        "kind": "tab",
        "auth_required": true,
        "tab": true,
        "entry_points": [
          "tab.tasks"
        ]
      },
      {
        "id": "tabs.tasks.detail",
        "path": "(tabs)/tasks/[taskId]",
        "kind": "detail",
        "auth_required": true,
        "tab": false,
        "entry_points": [
          "parent.tasks"
        ]
      },
      {
        "id": "tabs.tasks.create",
        "path": "(tabs)/tasks/create",
        "kind": "detail",
        "auth_required": true,
        "tab": false,
        "entry_points": [
          "parent.tasks"
        ]
      },
      {
        "id": "tabs.calendar",
        "path": "(tabs)/calendar/index",
        "kind": "tab",
        "auth_required": true,
        "tab": true,
        "entry_points": [
          "tab.calendar"
        ]
      },
      {
        "id": "tabs.filer",
        "path": "(tabs)/filer/index",
        "kind": "tab",
        "auth_required": true,
        "tab": true,
        "entry_points": [
          "tab.filer"
        ]
      },
      {
        "id": "tabs.filer.text",
        "path": "(tabs)/filer/text",
        "kind": "detail",
        "auth_required": true,
        "tab": false,
        "entry_points": [
          "parent.filer"
        ]
      },
      {
        "id": "tabs.docs",
        "path": "(tabs)/docs/index",
        "kind": "tab",
        "auth_required": true,
        "tab": true,
        "entry_points": [
          "tab.docs"
        ]
      },
      {
        "id": "tabs.docs.detail",
        "path": "(tabs)/docs/[nodeId]",
        "kind": "detail",
        "auth_required": true,
        "tab": false,
        "entry_points": [
          "parent.docs"
        ]
      },
      {
        "id": "tabs.apps",
        "path": "(tabs)/apps/index",
        "kind": "workspace",
        "auth_required": true,
        "tab": false,
        "entry_points": [
          "settings.apps",
          "sidebar.apps"
        ]
      },
      {
        "id": "tabs.apps.detail",
        "path": "(tabs)/apps/[appId]",
        "kind": "detail",
        "auth_required": true,
        "tab": false,
        "entry_points": [
          "parent.apps"
        ]
      },
      {
        "id": "tabs.settings",
        "path": "(tabs)/settings/index",
        "kind": "settings",
        "auth_required": true,
        "tab": false,
        "entry_points": [
          "settings"
        ]
      },
      {
        "id": "tabs.settings.appearance",
        "path": "(tabs)/settings/appearance",
        "kind": "settings",
        "auth_required": true,
        "tab": false,
        "entry_points": [
          "parent.settings"
        ]
      },
      {
        "id": "tabs.settings.profile",
        "path": "(tabs)/settings/profile",
        "kind": "settings",
        "auth_required": true,
        "tab": false,
        "entry_points": [
          "parent.settings"
        ]
      },
      {
        "id": "tabs.settings.audio",
        "path": "(tabs)/settings/audio",
        "kind": "settings",
        "auth_required": true,
        "tab": false,
        "entry_points": [
          "parent.settings"
        ]
      },
      {
        "id": "tabs.settings.ai_model",
        "path": "(tabs)/settings/ai-model",
        "kind": "settings",
        "auth_required": true,
        "tab": false,
        "entry_points": [
          "parent.settings"
        ]
      },
      {
        "id": "tabs.settings.custom_instructions",
        "path": "(tabs)/settings/custom-instructions",
        "kind": "settings",
        "auth_required": true,
        "tab": false,
        "entry_points": [
          "parent.settings"
        ]
      },
      {
        "id": "tabs.settings.docs_resync",
        "path": "(tabs)/settings/docs-resync",
        "kind": "settings",
        "auth_required": true,
        "tab": false,
        "entry_points": [
          "parent.settings"
        ]
      },
      {
        "id": "tabs.settings.sync_status",
        "path": "(tabs)/settings/sync-status",
        "kind": "settings",
        "auth_required": true,
        "tab": false,
        "entry_points": [
          "parent.settings"
        ]
      },
      {
        "id": "tabs.settings.sync_conflicts",
        "path": "(tabs)/settings/sync-conflicts",
        "kind": "settings",
        "auth_required": true,
        "tab": false,
        "entry_points": [
          "parent.settings"
        ]
      },
      {
        "id": "tabs.settings.connection",
        "path": "(tabs)/settings/connection",
        "kind": "settings",
        "auth_required": true,
        "tab": false,
        "entry_points": [
          "parent.settings"
        ]
      },
      {
        "id": "tabs.settings.notifications",
        "path": "(tabs)/settings/notifications",
        "kind": "settings",
        "auth_required": true,
        "tab": false,
        "entry_points": [
          "parent.settings"
        ]
      },
      {
        "id": "tabs.settings.character",
        "path": "(tabs)/settings/character",
        "kind": "settings",
        "auth_required": true,
        "tab": false,
        "entry_points": [
          "parent.settings"
        ]
      },
      {
        "id": "tabs.settings.memory",
        "path": "(tabs)/settings/memory",
        "kind": "settings",
        "auth_required": true,
        "tab": false,
        "entry_points": [
          "parent.settings"
        ]
      },
      {
        "id": "tabs.settings.mcp",
        "path": "(tabs)/settings/mcp",
        "kind": "settings",
        "auth_required": true,
        "tab": false,
        "entry_points": [
          "parent.settings"
        ]
      },
      {
        "id": "tabs.settings.remote_servers",
        "path": "(tabs)/settings/remote-servers",
        "kind": "settings",
        "auth_required": true,
        "tab": false,
        "entry_points": [
          "parent.settings"
        ]
      },
      {
        "id": "tabs.settings.about",
        "path": "(tabs)/settings/about",
        "kind": "settings",
        "auth_required": true,
        "tab": false,
        "entry_points": [
          "parent.settings"
        ]
      },
      {
        "id": "projects",
        "path": "projects",
        "kind": "workspace",
        "auth_required": true,
        "tab": false,
        "entry_points": [
          "sidebar.projects"
        ]
      },
      {
        "id": "project.detail",
        "path": "project/[id]",
        "kind": "detail",
        "auth_required": true,
        "tab": false,
        "entry_points": [
          "parent.projects"
        ]
      },
      {
        "id": "reports",
        "path": "reports",
        "kind": "workspace",
        "auth_required": true,
        "tab": false,
        "entry_points": [
          "sidebar.reports"
        ]
      },
      {
        "id": "report.timeline",
        "path": "report/timeline",
        "kind": "detail",
        "auth_required": true,
        "tab": false,
        "entry_points": [
          "parent.reports"
        ]
      },
      {
        "id": "operations",
        "path": "operations/index",
        "kind": "workspace",
        "auth_required": true,
        "tab": false,
        "entry_points": [
          "sidebar.operations"
        ]
      },
      {
        "id": "operations.work",
        "path": "operations/work/[workId]",
        "kind": "detail",
        "auth_required": true,
        "tab": false,
        "entry_points": [
          "parent.operations"
        ]
      },
      {
        "id": "native-intent",
        "path": "+native-intent",
        "kind": "deep_link",
        "auth_required": false,
        "tab": false,
        "entry_points": [
          "system.native_intent"
        ],
        "notes": "Expo Router system handler for verified HTTPS Gateway callbacks; accepted callbacks route to the login screen."
      }
    ],
    "entry_points": [
      {
        "id": "bootstrap",
        "kind": "bootstrap",
        "target": "root"
      },
      {
        "id": "auth",
        "kind": "auth",
        "target": "auth.login"
      },
      {
        "id": "tab.chat",
        "kind": "tab",
        "target": "tabs.chat"
      },
      {
        "id": "tab.tasks",
        "kind": "tab",
        "target": "tabs.tasks"
      },
      {
        "id": "tab.calendar",
        "kind": "tab",
        "target": "tabs.calendar"
      },
      {
        "id": "tab.filer",
        "kind": "tab",
        "target": "tabs.filer"
      },
      {
        "id": "tab.docs",
        "kind": "tab",